{
  "schemaVersion": "1.0",
  "toolId": "com.example.hello-web",
  "name": "Hello Web Tool",
  "version": "1.0.0",
  "publisher": {
    "keyId": "ed25519:9f8e7d6c5b4a39281706f5e4d3c2b1a09f8e7d6c5b4a3928",
    "name": "Example Community"
  },
  "description": "示例静态源中的免费 web 工具。",
  "entry": { "type": "web", "path": "payload/index.html" },
  "platforms": ["windows", "linux", "macos"],
  "architectures": ["x86_64", "aarch64"],
  "permissions": [],
  "minHostVersion": "0.1.0",
  "license": "Apache-2.0",
  "sourceCode": "https://tools.example.com/src/hello-web",
  "homepage": "https://tools.example.com/hello-web",
  "changelog": "首发。",
  "build": {
    "sourceCommit": "a1b2c3d4e5f6",
    "buildTimestamp": "2026-07-20T08:00:00Z",
    "builder": "useful-cli source publish",
    "reproducible": true,
    "provenanceReference": "https://tools.example.com/provenance/hello-web-1.0.0"
  },
  "files": [
    {
      "path": "payload/index.html",
      "sha256": "b5bb9d8014a0f9b1d61e21e796d78dccdf1352f23cd32812f4850b878ae4944c",
      "size": 2048
    },
    {
      "path": "assets/icon.png",
      "sha256": "7d865e959b2466918c9863afca942d0fb89d7c9ac0c99bafc3749504ded97730",
      "size": 4096
    }
  ]
}
